{
    "$schema": "./schema/schema.json",
    "circles": [
        {
            "transforms": {
                "posX": 0,
                "posY": 0,
                "radius": 1
            },
            "color": [0.6, 0.4, 0.3, 1],
            "body": {
                "velX": 0,
                "velY": 0,
                "mass": 0,
                "restitution": 0.3
            }
        },
        {
            "transforms": {
                "posX": 0,
                "posY": 0,
                "radius": 1
            },
            "color": [0.6, 0.4, 0.3, 1],
            "body": {
                "velX": 0,
                "velY": 0,
                "mass": 0,
                "restitution": 0.3
            }
        },
        {
            "transforms": {
                "posX": 0,
                "posY": 0,
                "radius": 1
            },
            "color": [1, 1, 1, 1],
            "body": {
                "velX": 0,
                "velY": 0,
                "mass": 0,
                "restitution": 0.2
            }
        }
    ],
    "walls": [
        {
            "transforms": {
                "posX": 0,
                "posY": 0,
                "scaleX": 1,
                "scaleY": 1,
                "rotation": 0
            },
            "color": [0.6, 0.4, 0.3, 1]
        }
    ],
    "ui": {
        "width": 800,
        "height": 800,
        "title": "John doe"
    },
    "world": {
        "gravity": [0, -500],
        "worldBackground": [0.3, 0.3, 0.3, 0.3]
    }
}
